{
  "schema_version": 1,
  "event_id": "20260827074957547-5e5d3c1c",
  "task_id": "readable-task-output",
  "type": "transitioned",
  "occurred_at": "2026-08-27T07:49:57.547Z",
  "actor_id": "codex",
  "base_revision": 3,
  "next_revision": 4,
  "data": {
    "from": "ready",
    "to": "in-progress",
    "reason": null,
    "blocker_added": null,
    "blockers_resolved": []
  }
}
